{
  "schema_version": 1,
  "event_id": "evt_council_finalized_cmd_council_finalize_conformance",
  "command_id": "cmd_council_finalize_conformance",
  "correlation_id": "sess_conformance_council",
  "session_id": "sess_conformance_council",
  "session_type": "council",
  "phase": "finalized",
  "type": "council_finalized",
  "from": "agent-mod",
  "to": [
    "agent-1",
    "agent-2"
  ],
  "created_at": "2026-06-06T01:00:00Z",
  "payload": {
    "final_summary": "Consensus reached for the static fixture handoff."
  },
  "causation_event_id": "evt_consensus_vote_cmd_council_vote_2_conformance"
}
