{
  "schema_version": 1,
  "event_id": "evt_argument_graph_legacy_only_speech_council",
  "command_id": "cmd_council_speak_argument_graph_legacy_only",
  "correlation_id": "sess_conformance_council",
  "session_id": "sess_conformance_council",
  "session_type": "council",
  "phase": "discussion",
  "type": "speech",
  "from": "agent-2",
  "to": [
    "agent-1",
    "agent-mod"
  ],
  "created_at": "2026-06-15T15:06:00Z",
  "payload": {
    "turn": 6,
    "speech": "For legacy consumers, this speech keeps the coarse response pointer without ARGUE stance links.",
    "responds_to_event_id": "evt_argument_graph_dual_field_speech_council",
    "evidence": []
  },
  "causation_event_id": "evt_speaker_selected_cmd_council_grant_conformance",
  "turn": 6
}
