{
  "schema_version": 1,
  "event_id": "evt_consensus_vote_requested_cmd_council_request_vote_conformance",
  "command_id": "cmd_council_request_vote_conformance",
  "correlation_id": "sess_conformance_council",
  "session_id": "sess_conformance_council",
  "session_type": "council",
  "phase": "consensus_vote",
  "type": "consensus_vote_requested",
  "from": "agent-mod",
  "to": [
    "agent-1",
    "agent-2"
  ],
  "created_at": "2026-06-06T01:00:00Z",
  "payload": {
    "draft_version": 1,
    "consensus_round": 1,
    "timeout_sec": 600
  },
  "causation_event_id": "evt_draft_conclusion_cmd_council_propose_conformance"
}
