{
  "schema_version": 1,
  "event_id": "evt_member_prepared_partial_cmd_council_prepared_partial_conformance",
  "command_id": "cmd_council_prepared_partial_conformance",
  "correlation_id": "sess_conformance_council",
  "session_id": "sess_conformance_council",
  "session_type": "council",
  "phase": "preparation",
  "type": "member_prepared_partial",
  "from": "agent-2",
  "to": [
    "agent-mod"
  ],
  "created_at": "2026-06-06T01:00:00Z",
  "payload": {
    "reason": "timeout",
    "summary": "Partial notes are available.",
    "notes_ref": "notes/static-agent-2.md"
  },
  "causation_event_id": "evt_preparation_requested_cmd_council_prepare_conformance"
}
