{
  "schema_version": 1,
  "event_id": "evt_preparation_requested_cmd_council_prepare_conformance",
  "command_id": "cmd_council_prepare_conformance",
  "correlation_id": "sess_conformance_council",
  "session_id": "sess_conformance_council",
  "session_type": "council",
  "phase": "preparation",
  "type": "preparation_requested",
  "from": "agent-mod",
  "to": [
    "agent-1",
    "agent-2"
  ],
  "created_at": "2026-06-06T01:00:00Z",
  "payload": {
    "topic": "Conformance council fixture",
    "timeout_sec": 600
  },
  "causation_event_id": "evt_agenda_locked_cmd_council_lock_agenda_conformance"
}
