{
  "schema_version": 1,
  "event_id": "evt_review_requested_cmd_delegate_review_conformance",
  "command_id": "cmd_delegate_review_conformance",
  "causation_event_id": "evt_work_submitted_cmd_delegate_submit_conformance",
  "correlation_id": "sess_conformance_delegation",
  "session_id": "sess_conformance_delegation",
  "session_type": "delegation",
  "phase": "under_review",
  "type": "review_requested",
  "from": "agent-mod",
  "to": [
    "agent-1"
  ],
  "created_at": "2026-06-05T01:03:00Z",
  "payload": {
    "review_focus": [
      "contract shape",
      "fail-closed behavior"
    ]
  }
}
