{
  "schema_version": 1,
  "event_id": "evt_speaker_selected_cmd_council_grant_conformance",
  "command_id": "cmd_council_grant_conformance",
  "correlation_id": "sess_conformance_council",
  "session_id": "sess_conformance_council",
  "session_type": "council",
  "phase": "discussion",
  "type": "speaker_selected",
  "from": "agent-mod",
  "to": [
    "agent-1"
  ],
  "created_at": "2026-06-06T01:00:00Z",
  "payload": {
    "turn": 1,
    "member": "agent-1",
    "selection_mode": "moderator_direct"
  },
  "causation_event_id": "evt_hand_raise_cmd_council_hand_raise_conformance",
  "turn": 1
}
