{
  "schema_version": 1,
  "event_id": "evt_runner_terminal_semantic_001",
  "command_id": "cmd_delegate_action_002",
  "correlation_id": "sess_conformance",
  "session_id": "sess_conformance",
  "session_type": "delegation",
  "phase": "working",
  "type": "assignee_update",
  "from": "agent-1",
  "to": [
    "agent-mod"
  ],
  "created_at": "2026-06-05T00:00:03Z",
  "runner": {
    "invocation_id": "run_conformance_002",
    "adapter_kind": "hermes-agent",
    "member": "agent-1",
    "attempt": 1,
    "is_retry": false,
    "source_command_id": "cmd_delegate_action_002",
    "status": "succeeded",
    "duration_sec": 3.0
  },
  "cost": {
    "tokens_in": 12,
    "tokens_out": 34,
    "usd_estimate": 0.056,
    "source": "hermes-agent-stderr-parse"
  },
  "payload": {
    "message": "deterministic fake runner update"
  }
}
