{
  "schema_version": 1,
  "event_id": "evt_created_001",
  "correlation_id": "sess_conformance_delegation",
  "session_id": "sess_conformance_delegation",
  "session_type": "delegation",
  "phase": "created",
  "type": "session_created",
  "from": "kkachi-agent-networkd",
  "to": [
    "agent-1",
    "agent-mod"
  ],
  "created_at": "2026-06-05T01:00:00Z",
  "payload": {
    "session_type": "delegation",
    "title": "Conformance delegation fixture",
    "moderator": "agent-mod",
    "participants": [
      "agent-mod",
      "agent-1"
    ],
    "limits": {}
  },
  "command_id": "cmd_create_conformance"
}
