{
  "schema_version": 1,
  "event_id": "evt_hand_raise_requested_cmd_council_poll_conformance",
  "command_id": "cmd_council_poll_conformance",
  "correlation_id": "sess_conformance_council",
  "session_id": "sess_conformance_council",
  "session_type": "council",
  "phase": "discussion",
  "type": "hand_raise_requested",
  "from": "agent-mod",
  "to": [
    "agent-1",
    "agent-2"
  ],
  "created_at": "2026-06-06T01:00:00Z",
  "payload": {
    "turn": 1,
    "research_timeout_sec": 600
  },
  "causation_event_id": "evt_member_prepared_partial_cmd_council_prepared_partial_conformance",
  "turn": 1
}
