{
  "schema_version": 1,
  "event_id": "evt_agenda_locked_cmd_council_lock_agenda_conformance",
  "command_id": "cmd_council_lock_agenda_conformance",
  "correlation_id": "sess_conformance_council",
  "session_id": "sess_conformance_council",
  "session_type": "council",
  "phase": "created",
  "type": "agenda_locked",
  "from": "agent-mod",
  "to": [
    "agent-1",
    "agent-2"
  ],
  "created_at": "2026-06-06T01:00:00Z",
  "payload": {
    "decision_question": "Should the static council contract ship?",
    "max_rounds": 2
  }
}
