{
  "schema_version": 1,
  "event_id": "evt_member_ready_cmd_council_ready_conformance",
  "command_id": "cmd_council_ready_conformance",
  "correlation_id": "sess_conformance_council",
  "session_id": "sess_conformance_council",
  "session_type": "council",
  "phase": "preparation",
  "type": "member_ready",
  "from": "agent-1",
  "to": [
    "agent-mod"
  ],
  "created_at": "2026-06-06T01:00:00Z",
  "payload": {
    "summary": "Found relevant protocol and fixture constraints.",
    "notes_ref": "notes/static-agent-1.md"
  },
  "causation_event_id": "evt_preparation_requested_cmd_council_prepare_conformance"
}
