{
  "schema_version": 1,
  "event_id": "evt_hand_raise_cmd_council_hand_raise_conformance",
  "command_id": "cmd_council_hand_raise_conformance",
  "correlation_id": "sess_conformance_council",
  "session_id": "sess_conformance_council",
  "session_type": "council",
  "phase": "discussion",
  "type": "hand_raise",
  "from": "agent-1",
  "to": [
    "agent-mod"
  ],
  "created_at": "2026-06-06T01:00:00Z",
  "payload": {
    "turn": 1,
    "intent": "support",
    "relevance": 5,
    "urgency": 3,
    "reason": "The static handoff is complete.",
    "wants_to_speak": true
  },
  "causation_event_id": "evt_hand_raise_requested_cmd_council_poll_conformance",
  "turn": 1
}
