{
  "schema_version": 1,
  "event_id": "evt_argument_graph_support_prior_council",
  "command_id": "cmd_council_speak_argument_graph_support",
  "correlation_id": "sess_conformance_council",
  "session_id": "sess_conformance_council",
  "session_type": "council",
  "phase": "discussion",
  "type": "speech",
  "from": "agent-2",
  "to": [
    "agent-1",
    "agent-mod"
  ],
  "created_at": "2026-06-15T15:01:00Z",
  "payload": {
    "turn": 2,
    "speech": "I support the traceability gate and add that static fixtures are the right handoff before runtime enforcement.",
    "claims": [
      {
        "claim_id": "T02.C1",
        "summary": "Static fixtures should precede runtime enforcement.",
        "kind": "proposal"
      }
    ],
    "stance_links": [
      {
        "target_event_id": "evt_argument_graph_opening_new_axis_council",
        "target_claim_id": "T01.C1",
        "stance": "support",
        "rationale": "Fixture handoff preserves the traceability requirement without claiming daemon validation."
      }
    ],
    "contribution_type": "support",
    "evidence": []
  },
  "causation_event_id": "evt_speaker_selected_cmd_council_grant_conformance",
  "turn": 2
}
