{
  "schema_version": 1,
  "event_id": "evt_speech_cmd_council_speak_conformance",
  "command_id": "cmd_council_speak_conformance",
  "correlation_id": "sess_conformance_council",
  "session_id": "sess_conformance_council",
  "session_type": "council",
  "phase": "discussion",
  "type": "speech",
  "from": "agent-1",
  "to": [
    "agent-2",
    "agent-mod"
  ],
  "created_at": "2026-06-06T01:00:00Z",
  "payload": {
    "turn": 1,
    "speech": "I support shipping the static council contract fixtures."
  },
  "causation_event_id": "evt_speaker_selected_cmd_council_grant_conformance",
  "turn": 1
}
