{
  "schema_version": 1,
  "event_id": "evt_hand_raise_dropped_cmd_council_drop_conformance",
  "command_id": "cmd_council_drop_conformance",
  "correlation_id": "sess_conformance_council",
  "session_id": "sess_conformance_council",
  "session_type": "council",
  "phase": "discussion",
  "type": "hand_raise_dropped",
  "from": "agent-2",
  "to": [
    "agent-mod"
  ],
  "created_at": "2026-06-06T01:00:01Z",
  "payload": {
    "turn": 1,
    "reason": "No new contribution for this response window.",
    "request_event_id": "evt_hand_raise_requested_cmd_council_poll_conformance",
    "observed_cursor": "cur_000000000007_evt_hand_raise_requested_cmd_council_poll_conformance",
    "stance_continuity": "preserved",
    "current_stance_summary": "No new claim added.",
    "accepted_claims": [
      "claim_static_handoff_complete"
    ],
    "wants_to_speak": false
  },
  "causation_event_id": "evt_hand_raise_requested_cmd_council_poll_conformance",
  "turn": 1
}
