{
  "schema_version": 1,
  "event_id": "evt_member_attended_cmd_council_attend_conformance",
  "command_id": "cmd_council_attend_conformance",
  "correlation_id": "sess_conformance_council",
  "session_id": "sess_conformance_council",
  "session_type": "council",
  "phase": "created",
  "type": "member_attended",
  "from": "agent-1",
  "to": [
    "agent-mod"
  ],
  "created_at": "2026-06-06T01:00:00Z",
  "payload": {
    "status": "present",
    "summary": "Present for static conformance."
  }
}
