{
  "schema_version": 1,
  "event_id": "evt_draft_conclusion_cmd_council_revise_conformance",
  "command_id": "cmd_council_revise_conformance",
  "correlation_id": "sess_conformance_council",
  "session_id": "sess_conformance_council",
  "session_type": "council",
  "phase": "draft_conclusion",
  "type": "draft_conclusion",
  "from": "agent-mod",
  "to": [
    "agent-1",
    "agent-2"
  ],
  "created_at": "2026-06-06T01:00:00Z",
  "payload": {
    "draft": "Ship the static COUNC conformance fixture set with full lifecycle traceability.",
    "revision_reason": "Added missing public command and event fixtures.",
    "supersedes_draft_version": 1,
    "draft_version": 2
  },
  "causation_event_id": "evt_consensus_vote_cmd_council_vote_conformance"
}
